{
  "manifestVersion": "1",
  "deploymentId": "bad-synthetic-demo-home-01",
  "siteId": "BAD",
  "display": {
    "productName": "NEXus",
    "siteName": "Entorno de demostración"
  },
  "persistenceMode": "session-only",
  "modules": [
    {
      "moduleId": "farmacia",
      "label": "Farmacia Hospitalaria",
      "entryPath": "farmacia_index.html",
      "enabled": true,
      "qualificationState": "QUALIFIED_FOR_SITE",
      "available": true,
      "platformCapabilities": [
        "static-delivery",
        "session-scoped-state",
        "offline-capable"
      ]
    },
    {
      "moduleId": "reuma",
      "label": "Hub Clínico Reuma",
      "entryPath": "reuma_index.html",
      "enabled": true,
      "qualificationState": "QUALIFIED_FOR_SITE",
      "available": true,
      "platformCapabilities": [
        "static-delivery",
        "session-scoped-state",
        "offline-capable"
      ]
    }
  ],
  "provenance": {
    "registryVersion": "1",
    "profileVersion": "1",
    "registrySha256": "7d2531e33d9e47fac1a07d11fd81609a5ae8986bf359b74e1a819b7ea86726e5",
    "profileSha256": "283d2cc83a7fa24a670e2123ccf7cf1b79833305ac866b5a30a3f513930b7629",
    "generator": "tools/deployment_manifest_build.mjs v1"
  }
}
