{
  "manifestVersion": "1",
  "deploymentId": "bad-synthetic-demo-01",
  "siteId": "BAD",
  "display": {
    "productName": "PROMueve Nexus",
    "siteName": "Deployment sintético BAD (demo)"
  },
  "persistenceMode": "session-only",
  "modules": [
    {
      "moduleId": "farmacia",
      "label": "Farmacia Hospitalaria",
      "entryPath": "farmacia_index.html",
      "enabled": true,
      "qualificationState": "IMPLEMENTED_NOT_QUALIFIED",
      "available": false,
      "platformCapabilities": [
        "static-delivery",
        "session-scoped-state",
        "offline-capable"
      ]
    },
    {
      "moduleId": "reuma",
      "label": "Hub Clínico Reuma",
      "entryPath": "index.html",
      "enabled": true,
      "qualificationState": "IMPLEMENTED_NOT_QUALIFIED",
      "available": false,
      "platformCapabilities": [
        "static-delivery",
        "session-scoped-state",
        "offline-capable"
      ]
    }
  ],
  "provenance": {
    "registryVersion": "1",
    "profileVersion": "1",
    "registrySha256": "1e0d26210d99176a1de39350729626bc8e95b2bba4ab0790fb5ecf713b3bccd5",
    "profileSha256": "e0a85d533faf7ccecfce073709f748c4a56332c36db95126c1b98aee07a62bd3",
    "generator": "tools/deployment_manifest_build.mjs v1"
  }
}
